{"type":"CityJSON","version":"1.1","CityObjects":{},"vertices":[],"transform":{"scale":[0.001,0.001,0.001],"translate":[9000000000.0,9000000000.0,9000000000.0]},"metadata":{"geographicalExtent":[0,0,0,0,0,0],"citymodelIdentifier":"95aa0dd4-1b84-4053-8f8d-9499819d4173","datasetReferenceDate":"2021-03-19","datasetCharacterSet":"UTF-8","datasetTopicCategory":"geoscientificInformation","distributionFormatVersion":"1.1","spatialRepresentationType":"vector","fileIdentifier":"minimal.json","metadataStandard":"ISO 19115 - Geographic Information - Metadata","metadataStandardVersion":"ISO 19115:2014(E)","metadataCharacterSet":"UTF-8","metadataDateStamp":"2021-05-18","textures":"absent","materials":"absent","cityfeatureMetadata":{},"thematicModels":[]}}