{"type":"CityJSON","version":"1.1","CityObjects":{"NL.IMBAG.Pand.0518100001755019":{"attributes":{"dak_type":"horizontal","data_area":2.1875,"data_coverage":0.2661913335323334,"documentnummer":"VMG20179462","geconstateerd":false,"gid":1080983,"h_dak_50p":2.0309998989105225,"h_dak_70p":2.049999952316284,"h_dak_max":2.1110000610351562,"h_dak_min":1.9889999628067017,"h_maaiveld":-0.4860000014305115,"identificatie":"NL.IMBAG.Pand.0518100001755019","kas_warenhuis":false,"lod11_replace":false,"ondergronds_type":"above ground","oorspronkelijkbouwjaar":1980,"pw_actueel":"yes","pw_bron":"ahn3","reconstructie_methode":"tudelft3d-geoflow","reconstruction_skipped":false,"rmse_lod12":0.0315316803753376,"rmse_lod13":0.031793348491191864,"rmse_lod22":0.027490859851241112,"rn":1,"status":"Pand in gebruik","t_run":41.638999938964844,"val3dity_codes_lod12":"[]","val3dity_codes_lod13":"[]","val3dity_codes_lod22":"[]","voorkomenidentificatie":1},"children":["NL.IMBAG.Pand.0518100001755019-0"],"type":"Building"},"NL.IMBAG.Pand.0518100001755019-0":{"attributes":{},"geometry":[{"boundaries":[[[[0,1,2,3]],[[4,1,0,5]],[[5,0,3,6]],[[7,2,1,4]],[[6,3,2,7]],[[6,7,4,5]]]],"lod":"1.2","semantics":{"surfaces":[{"type":"GroundSurface"},{"type":"RoofSurface"},{"on_footprint_edge":true,"type":"WallSurface"},{"on_footprint_edge":false,"type":"WallSurface"}],"values":[[0,2,2,2,2,1]]},"type":"Solid","material":{"color":{"values":[[0,0,0,0,0,0]]}}}],"parents":["NL.IMBAG.Pand.0518100001755019"],"type":"BuildingPart"}},"appearance":{"materials":[{"name":"roofandground","ambientIntensity":0.2,"diffuseColor":[0.9,0.1,0.75],"emissiveColor":[0.9,0.1,0.75],"specularColor":[0.9,0.1,0.75],"shininess":0.2,"transparency":0.5,"isSmooth":false}]},"vertices":[[338198,-42589,-486],[335196,-41370,-486],[336150,-39020,-486],[339152,-40239,-486],[335196,-41370,2041],[338198,-42589,2041],[339152,-40239,2041],[336150,-39020,2041]],"transform":{"scale":[0.001,0.001,0.001],"translate":[76364.556,451840.245,0.0]},"metadata":{"geographicalExtent":[76699.752,451797.656,-0.486,76703.708,451801.225,2.041]}}