{
  "type": "CityJSON",
  "version": "1.0",
  "CityObjects": {
    "onebuilding": {
      "type": "GenericCityObject",
      "geometry": [
        {
          "type": "CompositeSolid",
          "lod": 1,
          "boundaries": [
            [
              [
                [
                  [
                    0,
                    3,
                    2,
                    1
                  ]
                ],
                [
                  [
                    4,
                    5,
                    6,
                    7
                  ]
                ],
                [
                  [
                    0,
                    1,
                    5,
                    4
                  ]
                ],
                [
                  [
                    1,
                    2,
                    6,
                    5
                  ]
                ],
                [
                  [
                    2,
                    3,
                    7,
                    6
                  ]
                ],
                [
                  [
                    3,
                    0,
                    4,
                    7
                  ]
                ]
              ]
            ],
            [
              [
                [
                  [
                    1,
                    2,
                    9,
                    8
                  ]
                ],
                [
                  [
                    5,
                    10,
                    11,
                    6
                  ]
                ],
                [
                  [
                    1,
                    8,
                    10,
                    5
                  ]
                ],
                [
                  [
                    8,
                    9,
                    11,
                    10
                  ]
                ],
                [
                  [
                    9,
                    2,
                    6,
                    11
                  ]
                ],
                [
                  [
                    2,
                    1,
                    5,
                    6
                  ]
                ]
              ]
            ]
          ],
          "material":{
                    "irradiation": {
              "values": [[[0, 0, 1, null,1,8]],[[0,1,1,2,3,4]]]
            }
          },
          "texture":{"rgbTexture":{
            "values":[[[[[0,1,1,2,3]],[[0,3,4,5,3]],[[1,4,1,6,7]],[[0,1,1,2,3]],[[0,1,1,2,3]],[[0,1,1,2,3]]]],[[[[4,1,1,2,3]],[[3,3,4,5,3]],[[2,4,1,6,7]],[[1,1,1,2,3]],[[0,1,1,2,3]],[[10,1,1,2,3]]]]]}
          }
        }
      ]
    }
  },
  "vertices": [
    [
      0.0,
      0.0,
      0.0
    ],
    [
      1.0,
      0.0,
      0.0
    ],
    [
      1.0,
      1.0,
      0.0
    ],
    [
      0.0,
      1.0,
      0.0
    ],
    [
      0.0,
      0.0,
      1.0
    ],
    [
      1.0,
      0.0,
      1.0
    ],
    [
      1.0,
      1.0,
      1.0
    ],
    [
      0.0,
      1.0,
      1.0
    ],
    [
      2.0,
      0.0,
      0.0
    ],
    [
      2.0,
      1.0,
      0.0
    ],
    [
      2.0,
      0.0,
      1.0
    ],
    [
      2.0,
      1.0,
      1.0
    ]
  ]
}
