{
  "CityObjects": {
    "id-1": {
      "geometry": [
        {
          "boundaries": [
            [
              [
                [
                  [
                    0,
                    3,
                    2,
                    1
                  ]
                ],
                [
                  [
                    4,
                    5,
                    6,
                    7
                  ]
                ],
                [
                  [
                    0,
                    1,
                    5,
                    4
                  ]
                ],
                [
                  [
                    1,
                    2,
                    6,
                    5
                  ]
                ],
                [
                  [
                    2,
                    3,
                    7,
                    6
                  ]
                ],
                [
                  [
                    3,
                    0,
                    4,
                    7
                  ]
                ]
              ]
            ],
            [
              [
                [
                  [
                    8,
                    11,
                    10,
                    9
                  ]
                ],
                [
                  [
                    12,
                    13,
                    14,
                    15
                  ]
                ],
                [
                  [
                    8,
                    9,
                    13,
                    12
                  ]
                ],
                [
                  [
                    9,
                    10,
                    14,
                    13
                  ]
                ],
                [
                  [
                    10,
                    11,
                    15,
                    14
                  ]
                ],
                [
                  [
                    11,
                    8,
                    12,
                    15
                  ]
                ]
              ]
            ]
          ],
          "type": "MultiSolid",
          "lod": 1
        }
      ],
      "type": "GenericCityObject"
    }
  },
  "type": "CityJSON",
  "version": "1.0",
  "vertices": [
    [
      0.0,
      0.0,
      0.0
    ],
    [
      1.0,
      0.0,
      0.0
    ],
    [
      1.0,
      1.0,
      0.0
    ],
    [
      0.0,
      1.0,
      0.0
    ],
    [
      0.0,
      0.0,
      1.0
    ],
    [
      1.0,
      0.0,
      1.0
    ],
    [
      1.0,
      1.0,
      1.0
    ],
    [
      0.0,
      1.0,
      1.0
    ],
    [
      0.0,
      0.0,
      2.0
    ],
    [
      1.0,
      0.0,
      2.0
    ],
    [
      1.0,
      1.0,
      2.0
    ],
    [
      0.0,
      1.0,
      2.0
    ],
    [
      0.0,
      0.0,
      3.0
    ],
    [
      1.0,
      0.0,
      3.0
    ],
    [
      1.0,
      1.0,
      3.0
    ],
    [
      0.0,
      1.0,
      3.0
    ]
  ]
}
