{"CityObjects":{"id-1":{"geometry":[{"boundaries":[[[[0,1,2,3]],[[4,5,6,7]],[[0,3,5,4]],[[3,2,6,5]],[[2,1,7,6]],[[1,0,4,7]]]],"type":"Solid","lod":"1"}],"type":"+GenericCityObject"}},"version":"1.1","type":"CityJSON","vertices":[[0,0,0],[0,1000,0],[1000,1000,0],[1000,0,0],[0,0,1000],[1000,0,1000],[1000,1000,1000],[0,1000,1000]],"metadata":{"geographicalExtent":[0.0,0.0,0.0,1.0,1.0,1.0],"citymodelIdentifier":"61275d4f-079c-4dc5-a8a4-fd08a97c50a9","datasetReferenceDate":"2021-03-19","datasetCharacterSet":"UTF-8","datasetTopicCategory":"geoscientificInformation","distributionFormatVersion":"1.1","spatialRepresentationType":"vector","fileIdentifier":"cube.c.json","metadataStandard":"ISO 19115 - Geographic Information - Metadata","metadataStandardVersion":"ISO 19115:2014(E)","metadataCharacterSet":"UTF-8","metadataDateStamp":"2021-05-18","textures":"absent","materials":"absent","cityfeatureMetadata":{"+GenericCityObject":{"uniqueFeatureCount":1,"aggregateFeatureCount":1,"presentLoDs":{"1":1}}},"presentLoDs":{"1":1},"thematicModels":["+GenericCityObject"]},"transform":{"scale":[0.001,0.001,0.001],"translate":[0.0,0.0,0.0]}}