{"type":"CityJSON","version":"1.1","CityObjects":{"{CD98680D-A8DD-4106-A18E-15EE2A908D75}":{"type":"Building","attributes":{"TerrainHeight":2.93,"bron_tex":"UltraCAM-X 10cm juni 2008","voll_tex":"complete","bron_geo":"Lidar 15-30 punten - nov. 2008","status":"1"},"geometry":[{"type":"MultiSurface","boundaries":[[[0,1,2,3,4,5,6]],[[7,8,8,9,10]],[[11,12,13,14]],[[15,16,17,18]],[[1,0,19,15]],[[0,6,20,19]],[[6,5,12,11]],[[5,4,13,12]],[[3,2,7,10]],[[2,1,21,22]],[[9,8,18,17]],[[8,8,18,18]],[[8,7,23,24]],[[11,14,16,20]]],"semantics":{"values":[0,0,0,1,2,2,2,2,2,2,2,2,2,2],"surfaces":[{"type":"RoofSurface"},{"type":"GroundSurface"},{"type":"WallSurface"}]},"texture":{"rgbTexture":{"values":[[[0,0,1,2,3,4,5,6]],[[1,7,8,8,9,10]],[[2,11,12,13,14]],[[null]],[[1,15,16,17,18]],[[1,19,20,21,22]],[[3,23,24,25,26]],[[2,27,28,29,30]],[[1,31,32,33,34]],[[2,35,36,37,38]],[[4,39,40,41,42]],[[5,43,43,44,44]],[[3,45,46,47,48]],[[4,49,50,51,52]]]}},"lod":"2"}]}},"vertices":[[524038,209058,15311],[523657,208741,15311],[527714,203869,15311],[532519,207703,15311],[529417,211476,15311],[525121,207919,15311],[524122,209126,15311],[527714,203869,11136],[529970,201158,11136],[534759,204979,11136],[532519,207703,11136],[524122,209126,12869],[525121,207919,12869],[529417,211476,12869],[528421,212688,12869],[523657,208741,0],[528421,212688,0],[534759,204979,0],[529970,201158,0],[524038,209058,0],[524122,209126,0],[523657,208741,15151],[527714,203869,15151],[527714,203869,10976],[529970,201158,10976]],"transform":{"scale":[0.001,0.001,0.001],"translate":[90409.32,435440.44,0.0]},"appearance":{"textures":[{"type":"JPG","image":"appearances/0320_4_15.jpg"},{"type":"JPG","image":"appearances/0320_4_16.jpg"},{"type":"JPG","image":"appearances/0320_4_18.jpg"},{"type":"JPG","image":"appearances/0320_4_19.jpg"},{"type":"JPG","image":"appearances/0320_4_13.jpg"},{"type":"JPG","image":"appearances/0320_4_17.jpg"}],"vertices-texture":[[0.033,0.8854],[0.0372,0.8803],[0.1023,0.9349],[0.0507,0.9991],[0.0003,0.9573],[0.0482,0.9],[0.0321,0.8865],[0.314,0.3067],[0.2779,0.2764],[0.3291,0.2126],[0.3654,0.2427],[0.2542,0.25],[0.2703,0.2634],[0.2225,0.3206],[0.2064,0.3073],[0.455,0.0706],[0.4507,0.0756],[0.3687,0.0328],[0.3729,0.0279],[0.8032,0.3657],[0.8023,0.3668],[0.7203,0.3239],[0.7212,0.3228],[0.6559,0.4971],[0.6721,0.5104],[0.6587,0.5213],[0.6426,0.508],[0.5318,0.9429],[0.4835,0.9991],[0.4704,0.992],[0.5186,0.9359],[0.9671,0.1619],[0.9159,0.2256],[0.8889,0.222],[0.9399,0.1584],[0.1395,0.0753],[0.2038,0.1301],[0.2028,0.1305],[0.1385,0.0758],[0.1218,0.8882],[0.071,0.9515],[0.0,0.9421],[0.0504,0.8794],[0.7683,0.9476],[0.6973,0.9382],[0.4918,0.2573],[0.5275,0.2877],[0.5265,0.2881],[0.4908,0.2578],[0.4863,0.3843],[0.4381,0.4404],[0.3698,0.4039],[0.4175,0.3483]]},"metadata":{"referenceSystem":"urn:ogc:def:crs:EPSG::28992","geographicalExtent":[90932.97700000001,435641.598,0.0,90944.07900000001,435653.128,15.311],"citymodelIdentifier":"c8d5f7d1-393d-4539-a52c-efaf3694090d","datasetReferenceDate":"2021-03-19","datasetCharacterSet":"UTF-8","datasetTopicCategory":"geoscientificInformation","distributionFormatVersion":"1.1","spatialRepresentationType":"vector","fileIdentifier":"rotterdam_one.json","metadataStandard":"ISO 19115 - Geographic Information - Metadata","metadataStandardVersion":"ISO 19115:2014(E)","metadataCharacterSet":"UTF-8","metadataDateStamp":"2021-05-18","textures":"present","materials":"absent","cityfeatureMetadata":{"Building":{"uniqueFeatureCount":1,"aggregateFeatureCount":1,"presentLoDs":{"2":1}}},"presentLoDs":{"2":1},"thematicModels":["Building"]}}